,index,NM_CANDIDATO,NM_URNA_CANDIDATO,NM_UE,SG_PARTIDO,DS_SIT_TOT_TURNO,QT_VOTOS_NOMINAIS,VR_DESPESA_CONTRATADA,VR_RECEITA,VR_VOTO
0,30311,MARIVALDA MARTINS DOS SANTOS,MARIVALDA,MARAGOGIPE,PSOL,NÃO ELEITO,1,5812.249999999999,6751.06,5812.249999999999
1,33740,ALINE TORRES DE JESUS,PROFESSORA ALINE,ITACARÉ,PP,SUPLENTE,6,20000.0,20075.95,3333.3333333333335
2,728,MARIA DE LOURDES ROSA DE JESUS,BILEU,PONTO NOVO,PP,SUPLENTE,3,10000.0,10000.0,3333.3333333333335
3,27171,DAVI TOURINHO DE BRITO,DAVI TOURINHO,IRECÊ,PSOL,NÃO ELEITO,1,2881.35,3073.64,2881.35
4,22395,JOÃO DE ARAÚJO,ARAUJO,CAMAÇARI,PATRIOTA,NÃO ELEITO,42,119987.85,120920.0,2856.8535714285717
5,24734,ANE TATIANE PEREIRA SOUZA MONÇÃO,TATY MONÇÃO,SEBASTIÃO LARANJEIRAS,PSB,SUPLENTE,1,2825.0,2825.0,2825.0
6,14847,MARIA CLAUDIA COSTA DE SANTANA,CLAUDINHA,RIBEIRA DO POMBAL,PL,SUPLENTE,1,2355.0,1000.0,2355.0
7,17721,RITA PAULINA SANTOS DE SOUZA,ÉLITA PAULA,CORRENTINA,PODE,SUPLENTE,3,6870.0,6870.0,2290.0
8,34856,ÁUREA MARIA REIS,LÔRA DA VESPERINA,RIACHO DE SANTANA,PSD,SUPLENTE,5,11042.7,11642.7,2208.54
9,6131,NIKALICE AZEVEDO DOS SANTOS RIBEIRO,NIKALICE,ILHÉUS,PC do B,SUPLENTE,1,2159.9,3019.18,2159.9
10,30914,FERNANDA LUCIA PEREIRA,FERNANDA LUCIA,ITANHÉM,PT,NÃO ELEITO,2,4174.999999999999,4720.0,2087.4999999999995
11,14062,ROSANGELA MUNIZ DOS SANTOS,RÓ,ILHÉUS,PP,SUPLENTE,1,2000.0,2000.0,2000.0
12,10695,CLAUDIA JAMILLE PROENCIA AKKARI,JAMILLE CORRETORA,LAURO DE FREITAS,PATRIOTA,SUPLENTE,34,61799.070000000036,61800.0,1817.619705882354
13,5990,MARCIA XAVIER DE OLIVEIRA,MARCIA DE SINHÕ,IBIPITANGA,PSD,SUPLENTE,3,5040.0,5040.0,1680.0
14,13005,TAILANA PINHEIRO FERREIRA,TAILANA,CANDEIAS,AVANTE,SUPLENTE,3,5000.0,5000.0,1666.6666666666667
15,2475,GILDETE JESUS DE SANTANA,DETE,ARACI,PDT,SUPLENTE,1,1650.0,1650.0,1650.0
16,36850,CRISTIANO PEREIRA DA SILVA,CRISTIANO DO BAIXÃO,IRECÊ,PP,NÃO ELEITO,1,1600.0,0.0,1600.0
17,31264,MARCO HENRIQUE CARNEIRO DOURADO,HENRIQUE DOURADO,IRECÊ,DEM,NÃO ELEITO,1,1600.0,0.0,1600.0
18,37136,ADRIANO DAVID DE SOUSA,ADRIANO DO BAIXIO DE IRECÊ,IRECÊ,DEM,NÃO ELEITO,1,1600.0,0.0,1600.0
19,5746,MÔNICA ALMEIDA COSTA SILVA,MÔNICA,VITÓRIA DA CONQUISTA,PSC,SUPLENTE,1,1500.0,1500.0,1500.0
20,32190,LINDA MARIA DA COCEIÇÃO ALVES,LINDA MARIA,IRECÊ,AVANTE,SUPLENTE,1,1480.0,0.0,1480.0
21,29293,FABIANA SANTOS CONCEICAO,FABIANA SANCON,PORTO SEGURO,PROS,SUPLENTE,17,24577.9,51628.0,1445.7588235294118
22,34990,GISELIO BRITO DE LIMA,GISELIO DE DJALMA,ESPLANADA,MDB,SUPLENTE,1,1401.3,1401.3,1401.3
23,36943,CARLA FRANCIELLY ANDRADE SILVA,CARLA,PARAMIRIM,PSD,SUPLENTE,1,1400.0,1400.0,1400.0
24,34409,JOSE RAIMUNDO MOREIRA DUARTE,RAIMUNDINHO DOS BORGES,AMÉRICA DOURADA,PC do B,SUPLENTE,1,1320.0,1520.0,1320.0
25,8513,MARLI BRITO RIBEIRO,MARLI RIBEIRO,LICÍNIO DE ALMEIDA,DEM,NÃO ELEITO,1,1250.0,1250.0,1250.0
26,8662,VALERIA MENDES DE SOUZA PORTO,VALERIA MENDES,LAPÃO,PP,SUPLENTE,1,1240.9,0.0,1240.9
27,37014,JUCILEIDE DA SILVA SOUZA,LÊDA DA FARMÁCIA,CAMAÇARI,PSB,SUPLENTE,2,2414.0,2414.11,1207.0
28,14726,RITA DE CÁSSIA MALHEIROS CARVALHO,CASSINHA,GUANAMBI,PSDB,SUPLENTE,2,2400.0,0.0,1200.0
29,30007,JOSE CARLOS SOUZA DE MATOS,JOSE CARLOS SOUSA DE MATOS,CAPIM GROSSO,DEM,SUPLENTE,1,1197.35,1597.35,1197.35
30,17717,SUELI MONTALVÃO DA SILVA,SUELI MONTALVÃO,CORRENTINA,PODE,SUPLENTE,4,4780.0,4780.0,1195.0
31,14909,SILVIA HELENA BRITO TORRES SILVA,SILVIA DO PASTOR JOÃO,ITAGIBÁ,PDT,NÃO ELEITO,3,3500.0,3500.0,1166.6666666666667
32,30282,KAROLAINE SILVA FREITAS,KAROLAINE FREITAS,JEQUIÉ,PSB,SUPLENTE,1,1100.0,1100.0,1100.0
33,27058,DUCICLÉIA MACHADO ROCHA,KEU,SÃO GABRIEL,PSD,SUPLENTE,1,1100.0,100.0,1100.0
34,33957,KELLY GABRIELLE FERREIRA DA SILVA,KELLY DO LAVADOR,NOVA VIÇOSA,CIDADANIA,SUPLENTE,1,1063.77,4062.79,1063.77
35,19017,SHEYLA SOUVERAIN SANTOS RIOS,SHEYLA RIOS,SENHOR DO BONFIM,DEM,SUPLENTE,19,20000.0,20000.0,1052.6315789473683
36,30275,CLAYDISNEIA DANTAS DA SILVA,NEIA DANTAS,JEQUIÉ,PSB,SUPLENTE,1,1050.0,1050.0,1050.0
37,29274,MARIZETE SANTOS LIMA,ZETE,ITUAÇU,PSD,SUPLENTE,1,1045.0,0.0,1045.0
38,29281,MAGNA RIBEIRO AGUIAR,MAGNA,ITUAÇU,PSD,SUPLENTE,1,1045.0,0.0,1045.0
39,26161,RICARDO DE JESUS SOUZA,RICARDO SOUZA,SÃO MIGUEL DAS MATAS,PDT,SUPLENTE,2,2059.7,2000.0,1029.85
40,22407,MARCOS VALNILSON CONCEIÇÃO DA SILVA,MARCOS ÍNDIO,CAMAÇARI,PATRIOTA,NÃO ELEITO,3,3076.0,2900.0,1025.3333333333333
41,35641,GRAZIELE TEIXEIRA DA LUZ,IRMÃ GRAZI,ITACARÉ,PSC,NÃO ELEITO,1,1000.04,1000.0,1000.04
42,25100,VALERIA RIBEIRO DOS SANTOS,VALERIA RIBEIRO,IPUPIARA,PSD,SUPLENTE,1,1000.0,0.0,1000.0
43,34520,JOSE IRANILDO LEITE,IRANILDO CABELO,SERRA DO RAMALHO,PL,SUPLENTE,4,4000.0,500.0,1000.0
44,15299,ELISIO DUYPRATH DE ANDRADE FILHO,ELISIO ANDRADE,SALVADOR,REDE,NÃO ELEITO,4,3900.0,5197.0,975.0
45,14693,GERCIANE CASADO OLIVEIRA,GERCIANE,GUANAMBI,REPUBLICANOS,NÃO ELEITO,1,970.0,0.0,970.0
46,13680,CLÁUDIA CINTRA MORAIS,CLÁUDIA CINTRA,SALVADOR,PTC,NÃO ELEITO,4,3830.0,3913.0,957.5
47,29956,DANIELE AZEVEDO DE OLIVEIRA,DANI AZEVEDO,MAIRI,PC do B,SUPLENTE,2,1902.15,2190.48,951.075
48,19666,HILDA DA SILVA CERQUEIRA RODRIGUES MARQUES,HILDA CERQUEIRA,CAETITÉ,PSD,SUPLENTE,18,16457.5,19325.0,914.3055555555555
49,3460,MARIA DE LOURDES LIMA SANTOS TEIXEIRA,DONA LOURDES,CAETANOS,PC do B,SUPLENTE,1,859.0300000000001,859.03,859.0300000000001
50,19685,DAIANNE DE MIRANDA MORAES,DAIANNE DE DEI DE JUVENAL,CANÁPOLIS,PSD,NÃO ELEITO,6,5140.0,5140.0,856.6666666666666
51,1489,MARIA NILZA COELHO PRATES,MARIA NILZA,IBIRAPUÃ,PP,SUPLENTE,9,7665.45,8328.49,851.7166666666667
52,33385,GILMAIANE PORTO SILVA,GILMAIANE PORTO,ITIÚBA,PSD,SUPLENTE,1,850.0,850.0,850.0
53,9225,MÁRCIA MOEMA DOS SANTOS PEREIRA,MÁRCIA,RIO DE CONTAS,PSD,SUPLENTE,13,11037.5,13305.0,849.0384615384615
54,10852,VALDINEI DOS SANTOS NASCIMENTO,NEINHA DA TOMÉ DE SOUZA,SÃO DOMINGOS,SOLIDARIEDADE,SUPLENTE,6,5000.0,5750.6,833.3333333333334
55,15168,AROLDO MISQUITA CLARINDO,AROLDO,MUCURI,PL,NÃO ELEITO,3,2480.0,2495.0,826.6666666666666
56,254,JACIARA DA SILVA NOVAIS,JACY NOVAIS,ITUAÇU,PSL,NÃO ELEITO,1,823.9000000000001,1448.9,823.9000000000001
57,5652,ZÉLIA NOGUEIRA LIMA,ZÉLIA LIMA,VITÓRIA DA CONQUISTA,MDB,SUPLENTE,20,16003.6,17160.0,800.1800000000001
58,27159,FLAVIANE QUEIROZ SANTOS,FLAVIA QUEIROZ,PRESIDENTE DUTRA,PSB,SUPLENTE,1,800.0,800.0,800.0
59,252,BRENA FREIRE SILVA TEIXEIRA,BRENA FREIRE,ITUAÇU,PSL,NÃO ELEITO,1,800.0,1425.0,800.0
60,36851,JOEDILSON BATISTA FERREIRA DA SILVA,JOEDILSON DA VILA,IRECÊ,PP,NÃO ELEITO,2,1600.0,0.0,800.0
61,24039,MARIA DA GLORIA GOMES DA SILVA,GLORINHA DO SÍTIO,SANTO ESTEVÃO,PSD,SUPLENTE,4,3174.9999999999995,3175.0,793.7499999999999
62,12970,SIMONE CELESTINO DE JESUS,CAMARADA SIMONE,CANDEIAS,PC do B,NÃO ELEITO,14,11000.0,11849.83,785.7142857142857
63,17576,MARIA IÊDA VIEIRA DA SILVA,IÊDA,SERRINHA,PSC,NÃO ELEITO,1,780.0,780.0,780.0
64,17571,DULCINARA OLIVEIRA MOTA,DUCY DE NININHO DO FUMO,SERRINHA,PSC,NÃO ELEITO,1,780.0,780.0,780.0
65,28678,JOSÉ MARIA NEVES PEREIRA,DEDEZINHO,BRUMADO,PT,SUPLENTE,1,771.0,771.0,771.0
66,33127,ANGELICA SANTOS VIANA,ANGELICA VIANA,CARDEAL DA SILVA,PSOL,NÃO ELEITO,1,762.15,762.15,762.15
67,5205,MARILENE BATISTA DA SILVA,MARILENE BATISTA,PAULO AFONSO,PT,NÃO ELEITO,1,760.0,2120.0,760.0
68,4684,ROSANA SANTOS LIMA,ROSE,ALAGOINHAS,PSOL,NÃO ELEITO,6,4552.85,9989.0,758.8083333333334
69,21847,IVANI DOS SANTOS ARAGÃO,IVANI DE NOVA BRASÍLIA,MUCURI,PSC,SUPLENTE,2,1500.0,2400.0,750.0
70,30789,RAFAELA MAGNAVITA FERRAZ,RAFAELA,BELO CAMPO,PL,SUPLENTE,10,7500.0,7500.0,750.0
71,10715,VERÔNICA SANTANA BATISTA,VERONICA BATISTA,LAURO DE FREITAS,PATRIOTA,SUPLENTE,8,6000.0,6000.0,750.0
72,33357,DORACI DA SILVA PIRES,DORA,SEABRA,PDT,NÃO ELEITO,2,1490.0,1203.0,745.0
73,9071,GILDETE BOMFIM DE SANTANA,GILDETE DETE,SÃO FRANCISCO DO CONDE,PT,SUPLENTE,4,2951.75,3392.0,737.9375
74,34932,DENILSA NUNES MODESTO ALMEIDA,DENISE MODESTO,CONDE,MDB,SUPLENTE,7,5031.389999999999,6035.39,718.7699999999999
75,26008,BETIO EVARISTO CONCEIÇAO CRUZ,BETIO EVARISTO,PARAMIRIM,PL,SUPLENTE,2,1400.0,2570.0,700.0
76,30913,RODRIGO RICARDO SILVA FERREIRA,RODRIGO CANELA,ITANHÉM,PT,NÃO ELEITO,7,4874.999999999999,5620.0,696.4285714285713
77,21160,AGENORA DOS SANTOS ROCHA,LORINHA SANTOS,CACULÉ,DEM,SUPLENTE,2,1365.0,3046.0,682.5
78,31578,CRISPINA ANDREA PINTO CARQUEIJA,PINA,ITAPARICA,DEM,NÃO ELEITO,3,2032.0,2032.0,677.3333333333334
79,12637,EVANILDO FRANCISCO DE OLIVEIRA,DEGUINHA DE FULOR,IBIPITANGA,PT,NÃO ELEITO,2,1350.0,1350.0,675.0
80,14061,PAULO ROBERTO ANDRADE DOS SANTOS JUNIOR,PAULO,ILHÉUS,PP,SUPLENTE,3,2000.0,2000.0,666.6666666666666
81,10347,MARIA LUIZA ALMEIDA SOUZA,MARIA LUIZA,ARAÇÁS,PT,SUPLENTE,3,1999.0,1999.0,666.3333333333334
82,34017,ROSIANE DOS SANTOS SILVA,ROSIANE DOS SANTOS SILVA,VÁRZEA DA ROÇA,PSB,NÃO ELEITO,24,15947.999999999998,16020.0,664.4999999999999
83,643,DELVANDA PEREIRA DOS SANTOS,VANDINHA DE PEREIRA,MALHADA DE PEDRAS,PSD,SUPLENTE,11,7303.66,11000.0,663.9690909090909
84,5774,JISELE DE SOUZA SANTOS SILVA,JISELE SILVA,MACAÚBAS,PSD,SUPLENTE,6,3966.03,3966.67,661.005
85,22452,MERILIN PEREIRA BARBOSA,CHEIRINHO DE BANDEIRA,UTINGA,PT,SUPLENTE,1,660.0,920.0,660.0
86,31800,ANA CRISTINA SANCHO ALVES,ANA SANSHO,CACHOEIRA,PP,SUPLENTE,3,1980.0,1980.0,660.0
87,15506,MARIA OFELIA NOVAES,OFELIA,UTINGA,PSDB,SUPLENTE,1,660.0,920.0,660.0
88,33094,JOÃO PEREIRA FRAGA,JOÃO DE FRAGUINHA,MURITIBA,PSL,NÃO ELEITO,15,9760.0,10000.0,650.6666666666666
89,18231,LUZINETE SANTOS DE JESUS,LUZINETE,JEQUIÉ,PSOL,NÃO ELEITO,1,642.74,742.74,642.74
90,27660,DAMARES LIMA DA CRUZ SANTOS,DANDA FLOR DE LIS,CATU,PP,NÃO ELEITO,4,2548.0,2721.8199999999997,637.0
91,14471,ANTONIO COSME DE OLIVEIRA SOUZA,IRMÃO ANTONIO ,FEIRA DE SANTANA,PSL,NÃO ELEITO,16,10000.0,10000.0,625.0
92,15113,ZILAMAR PIOL,ZILAMAR PIOL,NOVA VIÇOSA,PSL,NÃO ELEITO,24,14999.999999999998,15000.0,624.9999999999999
93,27076,AUDINEIA GONÇALVES DA SILVA,NÉIA DA ESPLANADA,SÃO GABRIEL,PT,SUPLENTE,2,1246.5,1346.5,623.25
94,8663,MARIA ZILMA BEZERRA DE ALMEIDA,ZILMA,LAPÃO,PP,SUPLENTE,2,1240.9,0.0,620.45
95,2696,ARIANA VIEIRA MATOS,ARIANA MATOS,LAPÃO,DEM,SUPLENTE,2,1240.9,0.0,620.45
96,2703,MARIA DOLORES CARVALHO DE SOUZA NUNES,MARIA DOLORES,LAPÃO,DEM,SUPLENTE,2,1240.9,0.0,620.45
97,9056,ANA LUCIA DE JESUS BISPO,ANA BISPO,SÃO FRANCISCO DO CONDE,PT,SUPLENTE,8,4961.9,5400.0,620.2375
98,895,ANA LUCIA CERQUEIRA SERAPIÃO,ANA SERAPIÃO,SALVADOR,AVANTE,SUPLENTE,36,22140.949999999997,22500.0,615.0263888888888
99,9977,THIAGO DOS SANTOS CRUZ,THIAGO CRUZ,SÁTIRO DIAS,PT,NÃO ELEITO,1,610.0,610.0,610.0
100,36872,AMANDA DOS  SANTOS DIAS,AMANDA DIAS,ENTRE RIOS,REDE,NÃO ELEITO,3,1827.65,1827.65,609.2166666666667
101,12085,MARIA NETA GONÇALVES DE JESUS,MARIA NETA,LENÇÓIS,PSB,SUPLENTE,2,1210.0,1210.0,605.0
102,10970,VALDA CALIXTO TEIXEIRA,VALDA CALIXTO,LAURO DE FREITAS,PSDB,SUPLENTE,1,602.5,0.0,602.5
103,14288,MARIA MARTA CHAVES SANTOS SANTANA,PROFESSORA MARTA,NOVA REDENÇÃO,REDE,NÃO ELEITO,7,4200.0,4200.0,600.0
104,9265,LEILIANE CARLA ALVES DE BRITO,LEILA CARLA,CANDIBA,REPUBLICANOS,SUPLENTE,1,600.0,600.0,600.0
105,14554,MARIA RAIMUNDA SANTOS DE QUEIROZ,MARIA RAIMUNDA,BUERAREMA,PSDB,SUPLENTE,1,600.0,600.0,600.0
106,10369,CARLA RAMOS SILVA,CARLA RAMOS,BOTUPORÃ,PP,SUPLENTE,5,2967.199999999999,3767.2,593.4399999999998
107,9018,MARIA DA LUZ LIMA NUNES,DA LUZ,SÃO FRANCISCO DO CONDE,PSB,SUPLENTE,6,3554.9,6385.299999999999,592.4833333333333
108,24376,MARIA EDINOLIA DA SILVA ARAUJO,NOLIA SILVA,VALENTE,SOLIDARIEDADE,NÃO ELEITO,17,10000.0,10000.0,588.2352941176471
109,14910,CRISTIANE LINO DOS SANTOS,CRISTIANE DE BOGUÉ,ITAGIBÁ,PDT,NÃO ELEITO,6,3500.0,3500.0,583.3333333333334
110,838,IÊDA MAIA DE ALMEIDA,IÊDA ALMEIDA,SALVADOR,AVANTE,SUPLENTE,39,22458.300000000003,22500.0,575.8538461538462
111,26097,APARECIDO DOS SANTOS,CIDO DA RECICLAGEM,URANDI,PT,NÃO ELEITO,1,568.32,1068.32,568.32
112,22398,ALIONAI BATISTA DE SOUZA,PATETA DO POVO,CAMAÇARI,PATRIOTA,NÃO ELEITO,88,49973.149999999994,50470.0,567.8767045454545
113,834,ISABEL CRISTINA COUTINHO DO ESPIRITO SANTO,ISABEL CRISTINA,SALVADOR,AVANTE,SUPLENTE,40,22499.65,22500.0,562.49125
114,15625,ADEMÁRIO ANDRADE DE OLIVEIRA,ADEMARIO DA AMBULÂNCIA,BOM JESUS DA SERRA,PP,SUPLENTE,1,560.35,2790.35,560.35
115,8844,JACIRA PEREIRA DE OLIVEIRA,JACIRA DE GUIO,ITAPEBI,PODE,SUPLENTE,9,5000.0,5000.0,555.5555555555555
116,6950,INÊS CARDOSO CARVALHAL SANTOS,BINHA,SALVADOR,MDB,SUPLENTE,9,5000.0,10769.23,555.5555555555555
117,9226,ZULEIDE MINEIRO DOS SANTOS,DUDU,RIO DE CONTAS,PSD,SUPLENTE,22,12133.0,14305.0,551.5
118,16445,LUCIDALVA MARIA RIBEIRO,LÚ RIBEIRO,GUANAMBI,PSD,SUPLENTE,66,36392.43000000001,37658.0,551.4004545454546
119,2474,LUCILENE BISPO OLIVEIRA,CILENE DE BATOQUE,ARACI,PDT,SUPLENTE,3,1650.0,1650.0,550.0
120,17875,MARIA DO CARMO ROSA DE JESUS SOUSA,MARIA DA PONTE VELHA,CORRENTINA,AVANTE,SUPLENTE,1,542.25,3442.25,542.25
121,34852,MARIA SALVADORA DAS NEVES,SALVADORA,RIACHO DE SANTANA,PSD,SUPLENTE,22,11859.98,12160.0,539.09
122,24374,MANOEL DA CUNHA OLIVEIRA,MANOEL DE JUVILO,VALENTE,SOLIDARIEDADE,NÃO ELEITO,15,8000.0,8000.0,533.3333333333334
123,27170,DIAGNA PEREIRA DE OLIVEIRA,DIAGNA,IRECÊ,PSOL,NÃO ELEITO,6,3181.35,3398.49,530.225
124,31458,CLEMILDES DA SILVA,CLEMILDES,ALAGOINHAS,PODE,NÃO ELEITO,57,29900.0,30228.0,524.561403508772
125,22406,MARIA DA PAIXÃO DOS SANTOS,PAIXÃO,CAMAÇARI,PATRIOTA,NÃO ELEITO,12,6249.999999999997,7732.5,520.8333333333331
126,1204,ELIZABETE NOVAES SILVA,BETY NOVAES,JUSSIAPE,PSB,SUPLENTE,1,520.0,1540.0,520.0
127,25305,MARIA BENTILA DOS SANTOS,BENTA NEGO DO MATO,ENTRE RIOS,PSOL,NÃO ELEITO,6,3058.19,4588.1900000000005,509.6983333333333
128,29594,ELISABETE PINHEIRO CRUZ,BETE DE JOÃO RAPOZA,IPECAETÁ,PSD,SUPLENTE,1,500.0,500.0,500.0
129,29514,ADNETE ALVES DE SOUZA,NETE DE SAPO,IPECAETÁ,PP,SUPLENTE,1,500.0,500.0,500.0
130,9966,ALEXANDRE FABRICIO DE ALMEIDA MARTINS,ALEXANDRE DA HONRA,SOBRADINHO,SOLIDARIEDADE,NÃO ELEITO,2,1000.0,1000.0,500.0
131,36445,VERA LUCIA MARCAL,VERA PIVETINHA,JEQUIÉ,PSD,SUPLENTE,2,1000.0,1000.0,500.0
132,9296,NAYARA GOMES DE SÁ,NAYARA GOMES,PAULO AFONSO,PSL,NÃO ELEITO,2,1000.0,1550.0,500.0
133,35074,ANA LÚCIA LIMA ALMEIDA,LUCIA DO HOSCA,SERRINHA,DC,NÃO ELEITO,1,500.0,0.0,500.0
134,29142,ELIS MÁRCIA DOS SANTOS PIMENTEL,ELIMARCIA,ITAMBÉ,DC,NÃO ELEITO,2,1000.0,1000.0,500.0
135,26351,HERMENEGILDO DOMINGOS DOS SANTOS FILHO,HERMENEGILDO FILHO,ITABUNA,PMN,SUPLENTE,3,1500.0,1500.0,500.0
136,32881,NATALÍ ALVES RAMOS,NATALÍ ALVES,ÁGUA FRIA,REPUBLICANOS,NÃO ELEITO,4,1999.65,2055.1,499.9125
137,5767,NOELE DA MATA SOUSA,ROSA SOUSA,MACAÚBAS,PSD,SUPLENTE,8,3966.66,3966.67,495.8325
138,28209,MARIA DAS GRAÇAS LEAL SILVA GRANCHEUX BARBOSA,GAL GRANCHEUX,CANAVIEIRAS,PSL,NÃO ELEITO,42,20400.0,20535.48,485.7142857142857
139,14700,VANDILSON GONÇALVES TEIXEIRA,VANDILSON,GUANAMBI,REPUBLICANOS,NÃO ELEITO,2,970.0,970.0,485.0
140,36876,ANA JULIA MARIA DA SILVA BARBOSA,ROSA MARIA LUXEMBURGO,JUAZEIRO,PSOL,NÃO ELEITO,33,15856.24,16226.36,480.4921212121212
141,22712,SOLANGE DA SILVA DE JESUS,SOLANGE,CAMPO ALEGRE DE LOURDES,PT,SUPLENTE,8,3828.14,3828.14,478.5175
142,24733,LUCIENE PORTO SANTOS ARAUJO,LUCIENE PORTO NORA DE SALU,SEBASTIÃO LARANJEIRAS,PSB,SUPLENTE,7,3325.0,3325.0,475.0
143,12187,MARCIA SOLANGE MESSIAS DA SILVA,MARCIA,LAPÃO,PC do B,SUPLENTE,5,2370.0,2370.0,474.0
144,17727,DEISE CONRADO SOUZA,DEISE,ARAÇÁS,PODE,SUPLENTE,4,1895.0,2000.0,473.75
145,24375,JUSSARA SANTOS DE SOUZA,SARA SOUZA,VALENTE,SOLIDARIEDADE,NÃO ELEITO,23,10800.0,10820.46,469.5652173913044
146,14854,JOELMA SANTANA DE CASTRO,JOELMA,RIBEIRA DO POMBAL,PL,SUPLENTE,21,9855.0,17000.0,469.2857142857143
147,6316,POLIANA FERNANDES DOS SANTOS,POLY FERNANDES,LAFAIETE COUTINHO,PSD,SUPLENTE,2,922.3,922.3,461.15
148,29116,ELZA RODRIGUES DA SILVA,DONA ELZA,BRUMADO,PP,SUPLENTE,11,4999.210000000001,5000.0,454.47363636363644
149,24589,ALINE SANTOS ROCHA,ALINE ROCHA,ITARANTIM,PP,SUPLENTE,22,9989.449999999999,10150.0,454.06590909090903
150,31930,GISELE BISPO DE LIMA,GISELE,ÁGUA FRIA,PSB,SUPLENTE,1,450.0,450.0,450.0
151,6325,NADIA CARDOSO DOS SANTOS,NADIA CARDOSO,LAFAIETE COUTINHO,PSD,SUPLENTE,2,900.0,900.0,450.0
152,20531,GELCIA DOS ANJOS LEITE,GELCIA DO JACINTO,BREJOLÂNDIA,PL,SUPLENTE,1,450.0,450.0,450.0
153,20526,EDELZITA DOMINGOS DOS PASSOS,DELZITA,BREJOLÂNDIA,PL,SUPLENTE,1,450.0,450.0,450.0
154,13684,RIVAILTON PINTO VELOSO DA SILVA,RIVAILTON,SALVADOR,PTC,NÃO ELEITO,445,199814.0,200000.0,449.0202247191011
155,14728,MARILUCI TRINDADE DA SILVA,LÚCIA DO MONTE AZUL,GUANAMBI,PSDB,SUPLENTE,3,1320.85,1320.85,440.2833333333333
156,37,CREUZA DE JESUS LISBOA DA CRUZ,CREUZA GARI,IBIRAPUÃ,PTC,SUPLENTE,5,2200.0,2200.0,440.0
157,12249,ENIZALDIR BATISTA DE SOUSA,BIU DE DARINHO,NOVA REDENÇÃO,PC do B,NÃO ELEITO,3,1310.0,320.0,436.6666666666667
158,33759,ANA MEIRE DA PAIXÃO NOVAES,MEIRE NOVAES,SEABRA,REPUBLICANOS,SUPLENTE,3,1300.0,1303.0,433.3333333333333
159,10309,FLORIVAL DOS SANTOS DE JESUS JUNIOR,PISCA,ARAÇÁS,PSD,SUPLENTE,3,1286.45,2000.0,428.81666666666666
160,8956,NEVOLANDA MARTINS MARQUES DOS SANTOS,NEVOLANDA,IBITITÁ,PT,NÃO ELEITO,9,3850.0,3850.0,427.77777777777777
161,10704,VIVIANE DA SILVA BARRETO SALES,VIVIANE FOTOGRAFA,LAURO DE FREITAS,PATRIOTA,SUPLENTE,14,5980.0,6000.0,427.14285714285717
162,33821,LAUDELINO ALVES DE ARAUJO,LAUDELINO DO MOVIMENTO NEGRO,NOVA VIÇOSA,PT,NÃO ELEITO,2,850.0,850.0,425.0
163,19801,SINOVALDO PEREIRA DOS SANTOS,FOFAO,FEIRA DA MATA,PSD,SUPLENTE,4,1695.0,1705.1,423.75
164,4653,HELBER LEJUNO CARDOSO DE ARAUJO,IRMAO HELBER,CANSANÇÃO,PL,SUPLENTE,2,843.0,843.0,421.5
165,17854,MARA RÚBIA SAMPAIO ROCHA,MARA RÚBIA,CORRENTINA,PC do B,SUPLENTE,20,8410.5,8410.5,420.525
166,12992,MARIA ISABEL MOREIRA HILLING,PROFESSORA ISABEL,CANDEIAS,AVANTE,SUPLENTE,12,5000.0,5032.0,416.6666666666667
167,29124,CARDÊNIA NÚBIA NOGUEIRA MOREIRA,CARDÊNIA MOREIRA,BRUMADO,PP,SUPLENTE,12,5000.0,5000.0,416.6666666666667
168,5687,ROSANGELA AMORIM SANTOS,ROSA AMORIM,VITÓRIA DA CONQUISTA,PC do B,SUPLENTE,81,33485.85,37086.53,413.40555555555557
169,2477,MARIA REGINA FERREIRA MOTA,REGINA DE BERRO GROSSO,ARACI,PDT,SUPLENTE,4,1650.0,1650.0,412.5
170,29133,ANA MESSIAS DA SILVA,ANA MESSIAS ,BRUMADO,PP,SUPLENTE,17,7000.0,7000.0,411.7647058823529
171,22548,KEDMA CRISTIANE DIAS DA SILVA,GALEGA,CAMPO ALEGRE DE LOURDES,PC do B,SUPLENTE,9,3704.25,3704.25,411.5833333333333
172,886,LIDIANE MARIA MOREIRA DOS SANTOS,MISSIONÁRIA LIDIANE,SALVADOR,AVANTE,SUPLENTE,28,11324.5,27500.0,404.44642857142856
173,36835,ROQUE MACHADO NASCIMENTO,ROQUE MACHADO,JAGUAQUARA,REPUBLICANOS,SUPLENTE,3,1204.52,1204.52,401.50666666666666
174,20315,ELIZABETH FERREIRA DA CRUZ,BETH DE SANTA RITA,ITANHÉM,PSD,SUPLENTE,5,2000.0,2258.0,400.0
175,13194,ZILMAURELIA DE SOUSA BEZERRA,ZIL BEZERRA,BARREIRAS,AVANTE,SUPLENTE,20,8000.0,9104.0,400.0
176,8397,ROSANGELA CORDEIRO DOS SANTOS,NINA DO PEROVAZ,SALVADOR,CIDADANIA,SUPLENTE,15,6000.0,16248.64,400.0
177,12761,TATIANA ARAÚJO DE OLIVEIRA,TATY ARAÚJO,IRAJUBA,DEM,SUPLENTE,1,400.0,411.05,400.0
178,21566,JOSÉ ROBERTO DA SILVA,ROBERTO DO BUQUEIRÃO,ICHU,PSD,SUPLENTE,1,400.0,550.0,400.0
179,36848,GILSOMAR SILVA SANTOS,WEX SILVA,IRECÊ,PP,NÃO ELEITO,4,1600.0,0.0,400.0
180,30794,DAURA DOS SANTOS OLIVEIRA,DARIA,BELO CAMPO,PL,SUPLENTE,19,7500.0,7500.0,394.7368421052632
181,17739,UBALDINO DOS SANTOS FILHO,UBALDINO,ARAÇÁS,PODE,SUPLENTE,5,1970.0,2000.0,394.0
182,8409,JOSELIA FERREIRA DA SILVA,JOSELIA FERREIRA,SALVADOR,CIDADANIA,SUPLENTE,13,5000.0,13208.64,384.61538461538464
183,1486,BRUNO SILVA RANGEL,DR BRUNO DENTISTA,IBIRAPUÃ,PP,SUPLENTE,16,6144.45,6897.49,384.028125
184,13717,LUCIDALVA MANAIA DA SILVA DE JESUS,TIA LU,SALVADOR,PTC,NÃO ELEITO,10,3830.0,3913.0,383.0
185,23917,JOSE CARLOS SEVERO,CARLOS BOIADEIRO,MUCURI,MDB,NÃO ELEITO,4,1516.85,1816.85,379.2125
186,4979,LEILA DO NASCIMENTO DE SOUZA,LEILA NASCIMENTO,CRISTÓPOLIS,PSD,SUPLENTE,9,3394.0,3774.4,377.1111111111111
187,13210,JAIRES ESCOBAR DE SANTANA,JAIRES ESCOBAR,BARREIRAS,AVANTE,SUPLENTE,61,23000.0,23954.0,377.04918032786884
188,35725,MARIA IVONETE DE SOUSA BISPO,MARIA PIRIQUITA,PORTO SEGURO,PC do B,SUPLENTE,8,3000.0,4028.0,375.0
189,23007,ANSELMO RODRIGUES DA COSTA,ANSELMO COSTA,LAURO DE FREITAS,PSB,NÃO ELEITO,4,1500.0,2576.92,375.0
190,19625,SUZE ARLETE PEREIRA SILVA,SUZE DE PEQUENO CIGANO,FEIRA DA MATA,PSDB,SUPLENTE,5,1865.0,0.0,373.0
191,9072,JANDESON BARRETO DOS REIS,JANDESON BARRETO,SÃO FRANCISCO DO CONDE,PT,SUPLENTE,8,2983.8,2492.0,372.975
192,23374,JAILTON BEZERRA DA SILVA,PITTER DO CARRO DE SOM,PIRITIBA,MDB,SUPLENTE,1,370.0,370.0,370.0
193,35262,GUTEMBERG DA SILVA MARINS,GUTTO DOS CAIAQUES,GLÓRIA,PODE,SUPLENTE,1,370.0,1000.0,370.0
194,17029,EDNA REGINA DOS ANJOS PASSOS GOMES,EDNA DE TIZIL,MIGUEL CALMON,SOLIDARIEDADE,SUPLENTE,14,5179.65,6714.65,369.97499999999997
195,9070,EMILIANA BOMFIM,LIA BOMFIM,SÃO FRANCISCO DO CONDE,PT,SUPLENTE,8,2951.75,3390.0,368.96875
196,22308,LUCIENE FERREIRA DOS SANTOS,LUCIENE SANTOS,CAMAÇARI,PC do B,NÃO ELEITO,87,32067.649999999998,33420.0,368.5936781609195
197,17720,SIMONE SILVA DOURADO ARAÚJO,SIMONE DOURADO,CORRENTINA,PODE,SUPLENTE,20,7365.5,7365.5,368.275
198,33370,CLAUDIO MEIRA DE OLIVEIRA,CLAUDINHO,CAFARNAUM,PC do B,SUPLENTE,3,1100.0,200.0,366.6666666666667
199,27146,JOSÉ CARLOS BARBOSA DOS REIS,CARLINHOS REIS,SÃO GABRIEL,PSB,SUPLENTE,3,1100.0,100.0,366.6666666666667
200,19973,JEAN MAGALHÃES MARTINS,JEAN MAGALHÃES,CANDIBA,MDB,NÃO ELEITO,3,1100.0,2040.0,366.6666666666667
201,28152,ELZITA SANTOS DA SILVA,EUZITA,PARAMIRIM,PSD,SUPLENTE,4,1460.35,1460.35,365.0875
202,31828,TEREZA CRISTINA LIMA SANTOS,TEREZA CRISTINA,ITAMBÉ,PV,NÃO ELEITO,2,728.0,878.0,364.0
203,15837,SIDINEI MARCOS DE JESUS CURCINO,MARCÃO DO POVO,BOQUIRA,PL,SUPLENTE,11,4000.0,4000.0,363.6363636363636
204,2322,LUIS CLAUDIO SANTOS SILVA,LUIS CLAUDIO CONCHAVO,SALVADOR,PV,SUPLENTE,8,2900.0,3000.0,362.5
205,3507,DANIELA VITORIA DE OLIVEIRA,DANIELA,FEIRA DE SANTANA,PC do B,NÃO ELEITO,3,1070.0,2238.18,356.6666666666667
206,4475,MARCELO LUZ PASSOS,MARCELO PASSOS,CAIRU,PC do B,NÃO ELEITO,3,1062.0,1662.0,354.0
207,4045,EDINETE PEREIRA DE JESUS BARBOSA,EDINETE,TAPIRAMUTÁ,PP,SUPLENTE,17,6000.0,6000.0,352.94117647058823
208,30216,DAIANE CAROLINE SANTANA,DAIANE SANTANA,CIPÓ,PSD,NÃO ELEITO,1,350.08000000000004,0.0,350.08000000000004
209,26392,JESSICA MONTEIRO DE MAGALHAES,JESSICA MAGALHAES,CORRENTINA,PSD,SUPLENTE,4,1400.0,1400.0,350.0
210,26396,MARIA APARECIDA BARBOSA DA SILVA,CIDA DE DONA EDITE,CORRENTINA,PSD,SUPLENTE,4,1400.0,1400.0,350.0
211,5429,HELENA CRISTINA POSENER DE ANDRADE,DRA HELENA POSENER,LAURO DE FREITAS,PSD,SUPLENTE,43,15000.0,18877.5,348.83720930232556
212,29278,ANA CAROLINA RODRIGUES DE OLIVEIRA,CAROL,ITUAÇU,PSD,SUPLENTE,3,1045.0,0.0,348.3333333333333
213,28957,CLEIDE DE SOUZA AGUIAR,CLEIDE,ITUAÇU,PDT,NÃO ELEITO,3,1045.0,0.0,348.3333333333333
214,33551,NOELDA FERNANDES DA SILVA ALVES,NOELDA DA CANABRAVA,FORMOSA DO RIO PRETO,PSC,NÃO ELEITO,3,1043.9,1043.9,347.9666666666667
215,18942,JOÃO MARTINS CERQUEIRA FILHO,JOÃO DE JONGA,CORAÇÃO DE MARIA,PTB,NÃO ELEITO,46,15951.0,16200.0,346.7608695652174
216,19014,JESSICA ALVES DA COSTA,JESSICA ALVES,SENHOR DO BONFIM,DEM,SUPLENTE,58,20000.0,20000.0,344.82758620689657
217,21228,ANDRELITA MATOS DA SILVA,DÉA DO COQUEIRO,CAMAMU,REDE,SUPLENTE,29,10000.0,10000.0,344.82758620689657
218,9142,CLEDIANA DIAS DOS SANTOS,CLEDIANA,PLANALTO,PP,SUPLENTE,29,10000.0,10000.0,344.82758620689657
219,35039,DOMINGOS FRANCISCO OLIVEIRA NETO,OLIVEIRA GENRO DO DR MOISES,TUCANO,PC do B,NÃO ELEITO,5,1715.0,1774.58,343.0
220,14727,IVANIE SANTANA FERNANDES,IVANIE SANTANA,GUANAMBI,PSDB,SUPLENTE,7,2400.0,2400.0,342.85714285714283
221,13839,CALIANA MESQUITA NOGUEIRA,CALIANA MESQUITA,ILHÉUS,PTB,SUPLENTE,88,29910.000000000007,29910.0,339.88636363636374
222,16774,LIVANA MARIA RIBEIRO FONTES,LIVANA FONTES,ITABUNA,PSL,SUPLENTE,109,36973.9,37000.0,339.2100917431193
223,19791,VANILDA VIEIRA DE SOUZA,VANILDA VIEIRA,FEIRA DA MATA,PSD,SUPLENTE,5,1695.0,1716.15,339.0
224,2465,MARIA CAROLINA DUARTE,CAROL,ARACI,PDT,SUPLENTE,5,1694.2,1704.0,338.84000000000003
225,32917,AMANDA MURIEL LIMA SANTOS GOMES,AMANDA,WENCESLAU GUIMARÃES,DEM,SUPLENTE,1,337.5,351.5,337.5
226,32913,DEJANE PAULINO DE SOUZA,DEJANE,WENCESLAU GUIMARÃES,DEM,SUPLENTE,1,337.5,352.0,337.5
227,32919,LUANA CARVALHO MENEZES,LUANA DE CABEÇA,WENCESLAU GUIMARÃES,DEM,SUPLENTE,1,337.5,351.5,337.5
228,24635,CAROLINE SANTANA DE JESUS,CAROL DE NILZA,WENCESLAU GUIMARÃES,PSB,SUPLENTE,1,337.5,351.5,337.5
229,36965,ELIANA SANTOS DA SILVA,ELIANA,PAU BRASIL,REDE,SUPLENTE,8,2700.0,2500.0,337.5
230,3065,REGILANIA FARIAS,REGILANIA ESPOSA DE SALATIEL,PEDRO ALEXANDRE,PP,SUPLENTE,15,5025.25,5026.0,335.01666666666665
231,17744,LEONARDO RIBEIRO DOS SANTOS,LÉO DO GÁS,ARAÇÁS,AVANTE,NÃO ELEITO,6,2000.35,2000.35,333.39166666666665
232,28411,ÉLIDA FÁTIMA PEREIRA SANTOS,ÉLIDA DE EVALDO,ÉRICO CARDOSO,REPUBLICANOS,SUPLENTE,3,1000.0,1000.0,333.3333333333333
233,36414,ROSALVA MARIA LINS DOS SANTOS,ROSA,BONINAL,REDE,SUPLENTE,3,1000.0,1000.0,333.3333333333333
234,20748,ALOISIO DE JESUS,ALOISIO IRMAO DE DOIS MIL,ESPLANADA,PODE,SUPLENTE,12,4000.0,5620.0,333.3333333333333
235,13007,JOSE ROBERTO DOS SANTOS,KONFU CADEIRANTE,CANDEIAS,AVANTE,SUPLENTE,12,4000.0,4000.0,333.3333333333333
236,18235,IVANETE TIGRE DE JESUS SILVA,NETA,CÂNDIDO SALES,PTB,NÃO ELEITO,5,1664.0,1664.0,332.8
237,882,NILDES GONÇALVES CONCEIÇÃO,TUTUA,SALVADOR,AVANTE,SUPLENTE,83,27500.0,27500.0,331.32530120481925
238,19660,CÉLIA SANTOS GOMES NOGUEIRA CAIRES,CÉLIA SANTOS,CAETITÉ,PSD,SUPLENTE,57,18871.7,20525.0,331.08245614035087
239,23066,MARIA DA PAZ SANTANA,MARIA DA PAZ,BOM JESUS DA LAPA,PT,SUPLENTE,6,1985.0,1985.0,330.8333333333333
240,15436,ARIVALDO DE OLIVEIRA CORTES,ARY,UTINGA,PSB,SUPLENTE,2,660.0,1811.95,330.0
241,12716,GILVAN SILVA SANTOS,PROFESSOR GILVAN,SÃO FRANCISCO DO CONDE,PP,SUPLENTE,9,2959.0,4280.0,328.77777777777777
242,27174,IVONE DA SILVA COELHO,VONE,ALMADINA,PROS,SUPLENTE,3,980.35,1380.0,326.78333333333336
243,7852,ANA IRES CORDEIRO DE BRITO,ANA IRES,CANDEAL,PT,SUPLENTE,2,650.0,650.0,325.0
