,NM_CANDIDATO,NM_URNA_CANDIDATO,NM_UE,SG_PARTIDO,DS_SIT_TOT_TURNO,QT_VOTOS_NOMINAIS,VR_DESPESA_CONTRATADA,VR_RECEITA
0,SAMUEL RODRIGUES DOS SANTOS,DR SAMUKA,CAMAÇARI,CIDADANIA,ELEITO POR MÉDIA,1745,0.0,18266.13
1,SILVIO PEREIRA DA SILVA,SILVIO BAIANO,BARRA,PSDB,ELEITO POR QP,1220,0.0,0.0
2,EDERJÚNIOR SANTOS DOS ANJOS,EDERJÚNIOR,ILHÉUS,PSL,ELEITO POR QP,1206,0.0,282.5
3,IRANDI ALVES RODRIGUES,SABIDO,BARRA,PP,ELEITO POR QP,1163,0.0,850.0
4,MARIA DO SOCORRO LEONARDO NUNES,SOCORRO,BARRA,PSDB,ELEITO POR QP,1135,0.0,0.0
5,FABIANO SA DE OLIVEIRA,FABIANO DE ZEZÃO,GLÓRIA,PP,ELEITO POR QP,1126,0.0,6150.0
6,CLEITON VIEIRA PINTO,CLEITON VIEIRA,SENHOR DO BONFIM,PC do B,ELEITO POR QP,1088,0.0,800.0
7,PEDRO CALDEIRA RAMOS,PEDRO CALDEIRA,BARRA,PP,ELEITO POR QP,1035,0.0,850.0
8,MARINALDO PEREIRA MARQUES,BATATINHA DA RADIO,BARRA,PP,ELEITO POR QP,1011,0.0,850.0
9,YURE RAMON DA SILVA CUNHA,YURE RAMON ,BARREIRAS,MDB,ELEITO POR MÉDIA,985,0.0,3473.0
10,EDVALDO LEITE DE SOUZA,EDVALDO DE ZÉ DE KELÉ,SERRINHA,SOLIDARIEDADE,ELEITO POR QP,970,0.0,2410.0
11,JOSÉ EDUARDO SANTANA CRUZ,ZÉ EDUARDO,CASA NOVA,PSDB,ELEITO POR MÉDIA,937,0.0,0.0
12,MARCOS ELIÉZIO DOS SANTOS SILVA,MARQUINHOS DO LÊU,MONTE SANTO,PSC,ELEITO POR QP,920,0.0,1330.0
13,ERALDO ROCHA DE SOUZA,ERALDO DA SAÚDE,NOVA SOURE,PSD,ELEITO POR QP,906,0.0,1662.54
14,JACSON TRINDADE DE SANTANA,JÁI DE JOÃO MACHADO,RAFAEL JAMBEIRO,DEM,ELEITO POR QP,880,0.0,472.0
15,JIVALDO DE SOUZA LIMA,VADU,BARRA,PSDB,ELEITO POR QP,875,0.0,0.0
16,ODAIR JOSE PEREIRA DE OLIVEIRA,DAI DE CORI,TREMEDAL,PSD,ELEITO POR QP,862,0.0,0.0
17,IVAN MERCÊS DE AZEVEDO,IVAN FILHO,VERA CRUZ,MDB,ELEITO POR QP,858,0.0,0.0
18,JOAO BATISTA DA SILVA,BATISTA,MONTE SANTO,PSC,ELEITO POR QP,847,0.0,1330.0
19,SALVIANO NUNES DE SOUZA,SALVINHO,BARRA,PL,ELEITO POR QP,839,0.0,850.0
20,MARCELO FRANCISCO DA SILVA,LELO DO PROJETO,ABARÉ,PT,ELEITO POR QP,816,0.0,0.0
21,GILMAR PEREIRA ARAUJO,GILMAR PEREIRA,GLÓRIA,PP,ELEITO POR QP,795,0.0,6350.0
22,ZENILDO ABREU OLIVEIRA,ZENILDO ABREU,TANHAÇU,DEM,ELEITO POR MÉDIA,792,0.0,500.0
23,ELYABE LOPES RIBEIRO BARROS,ELYABE BARROS,SENTO SÉ,PSDB,ELEITO POR QP,775,0.0,0.0
24,LUSIANE MAIA DE SOUZA,LUSIANE DA SAÚDE,ITAJUÍPE,PSD,ELEITO POR QP,773,0.0,0.0
25,NILDO ALCANTARA DE SOUZA,NILDO ALCANTARA,BARRA,PL,ELEITO POR QP,769,0.0,850.0
26,LUCIANO LUNA SOUZA,LUCIANO LUNA,ILHÉUS,PV,ELEITO POR MÉDIA,764,0.0,282.5
27,MATEUS ARAUJO AFFONSO MATTOS,MATEUS MALA,ITAJUÍPE,PODE,ELEITO POR QP,754,0.0,0.0
28,ANTONIO ALMEIDA DOS SANTOS,TÕE DE DIVÁ,BOQUIRA,PSB,ELEITO POR QP,753,0.0,1304.0
29,GILMAR ALVES DE SANTANA,AMBA,RAFAEL JAMBEIRO,PT,ELEITO POR QP,742,0.0,0.0
30,PLINIO BASTOS DE MATOS FILHO,PLINIO FILHO,BARRA DO MENDES,PSD,ELEITO POR QP,739,0.0,2110.0
31,ANTONIO MARTINS DOS SANTOS,TONHO DO BODE,FORMOSA DO RIO PRETO,PSD,ELEITO POR QP,730,0.0,400.13
32,AILTON PIER DA PAIXÃO COSTA,AILTON DE MIUDINHO,PLANALTO,PSD,ELEITO POR MÉDIA,704,0.0,0.0
33,VAGNES DOMINGUES CARDOSO,ZIM DO BURITI,BOQUIRA,PSB,ELEITO POR QP,701,0.0,1304.0
34,EDIVAN SOARES DE ARAUJO,VAN DE NINGA,CATU,PATRIOTA,ELEITO POR QP,700,0.0,0.0
35,AELSON GONÇALVES LIMA,GALEGO DA BATERIA,BOQUIRA,PSD,ELEITO POR QP,700,0.0,1304.0
36,MISAEL BANDEIRA LOPES,MISA BANDEIRA,PÉ DE SERRA,DEM,ELEITO POR QP,698,0.0,0.0
37,EDILSON NUNES ALECRIM,EDILSON CACHOEIRA,IRECÊ,REPUBLICANOS,ELEITO POR MÉDIA,694,0.0,1000.0
38,FABIANO DE LIMA,BILÚ,AMÉLIA RODRIGUES,PP,ELEITO POR QP,690,0.0,0.0
39,ADAILTON CORREIA DA CRUZ,ALONGADO DE MARCIO MORENO,MARAGOGIPE,REPUBLICANOS,ELEITO POR QP,688,0.0,0.0
40,ADÃO LIMA DE ANDRADE,ADÃO LIMA,ITABUNA,PSB,ELEITO POR MÉDIA,687,0.0,1063.8
41,PAULO GOMES DE OLIVEIRA,PAULO GOMES,GLÓRIA,PP,ELEITO POR QP,676,0.0,6350.0
42,ADELAR BRACHMANN,ADELAR DO CAPIM,CRISTÓPOLIS,PSD,ELEITO POR QP,675,0.0,3400.5
43,OSMAR FERREIRA DE SOUZA,OSMAR,INHAMBUPE,PODE,ELEITO POR QP,673,0.0,362.5
44,ODENILTON CARDOSO DE ARAUJO,ITO CARDOSO,SERRINHA,PT,ELEITO POR MÉDIA,671,0.0,3170.0
45,EDVALDO NETO GOMES,EDVALDO GOMES,ILHÉUS,DEM,ELEITO POR QP,670,0.0,0.0
46,JEAN CARLOS DA SILVA MOREIRA,JEAN CARLOS,MASCOTE,REPUBLICANOS,ELEITO POR QP,665,0.0,769.22
47,FABIO MELLO DE ANDRADE,FABIO FRANGA,TEOLÂNDIA,REPUBLICANOS,ELEITO POR QP,658,0.0,0.0
48,DEVANIR RODRIGUES FIGUEIRA,DEVANIR FIGUEIRA,SÃO DESIDÉRIO,DEM,ELEITO POR MÉDIA,657,0.0,641.0
49,ROBERTO CORREIA DE ANDRADE,ROBERTINHO ANDRADE,FORMOSA DO RIO PRETO,PSD,ELEITO POR QP,651,0.0,400.13
50,ANTONIO FERREIRA DA SILVA,ANTÔNIO DE URCINO,TREMEDAL,PSD,ELEITO POR QP,646,0.0,0.0
51,ELIEZER SALOMÉ RAMOS FERREIRA,ELIEZER DA FARINHA,INHAMBUPE,PODE,ELEITO POR QP,645,0.0,362.5
52,CLAUDENICE CARVALHO BORGES PEREIRA,NINHA,BARRA,PSDB,ELEITO POR MÉDIA,644,0.0,0.0
53,VANILSON DIAS DE ARAÚJO,VANILSON (DORA),MANSIDÃO,SOLIDARIEDADE,ELEITO POR QP,643,0.0,0.0
54,CARLOS ANTONIO DOS SANTOS,PÉ DA SAÚDE,CABACEIRAS DO PARAGUAÇU,PSD,ELEITO POR QP,638,0.0,0.0
55,CLAUDIO PINHEIRO DOS SANTOS,CLÁUDIO,OLINDINA,PSD,ELEITO POR QP,630,0.0,1380.0
56,EDSON TEIXEIRA DA CUNHA,EDI,OLIVEIRA DOS BREJINHOS,PSD,ELEITO POR QP,625,0.0,4830.0
57,ANTONIO MARCOS OLIVEIRA DA COSTA,ANTÔNIO MARCOS AMIGO DO POVO,GLÓRIA,PP,ELEITO POR QP,624,0.0,6150.0
58,ROMERO SANTIAGO BARBOSA NETO,ROMERO,BARRA,PL,ELEITO POR QP,623,0.0,850.0
59,MIGUEL ALVES DE ARAÚJO,MIGUEL DA CANARINA,BARRA DO MENDES,PSD,ELEITO POR QP,616,0.0,710.0
60,EDMILSON AFONSO DA SILVA,MISSÃO DE DOTOR,GLÓRIA,PP,ELEITO POR QP,616,0.0,6350.0
61,VILMA SANTOS REIS,VILMA DO PEIXE,SERRA PRETA,DEM,ELEITO POR QP,615,0.0,0.0
62,ADILSON DE OLIVEIRA SANTOS,ADILSON DO JACÚ,SERRA PRETA,DEM,ELEITO POR QP,611,0.0,0.0
63,JAILSON BONFIM LIMA,PROFESSOR JAILSON,MARAGOGIPE,REPUBLICANOS,ELEITO POR QP,611,0.0,600.0
64,AILSON DE SOUZA SELIS,AILSON SELIS,MUQUÉM DO SÃO FRANCISCO,PSB,ELEITO POR QP,599,0.0,7250.04
65,SEBASTIÃO TEIXEIRA DE ARAUJO,TIÃO DE RODA VELHA,SÃO DESIDÉRIO,PSDB,ELEITO POR QP,597,0.0,1921.8999999999999
66,ERINALDO NASCIMENTO SODRÉ,ERINHO,IAÇU,PSD,ELEITO POR QP,595,0.0,300.0
67,ROBERIO SANTOS BARROS,ROBERIO,PRADO,PROS,ELEITO POR QP,594,0.0,128.0
68,CLODOALDO DA COSTA BRAGA,CLODOALDO BRAGA,MUQUÉM DO SÃO FRANCISCO,PP,ELEITO POR QP,593,0.0,7706.06
69,JONATAS NEGREIROS ROCHA GOMES,JONATAS DE ROMEU,APORÁ,PSD,ELEITO POR QP,592,0.0,0.0
70,GEAN MARCIO DE SOUZA SILVA,GEAN DE VASCONCELOS,ITAJUÍPE,PODE,ELEITO POR QP,591,0.0,0.0
71,WILTON MELO SANTOS,WILTON MELO,ANGUERA,PL,ELEITO POR QP,590,0.0,500.0
72,JAMILTON NASCIMENTO DOS SANTOS,JAMILTON JAI,BOQUIRA,PSD,ELEITO POR QP,590,0.0,1304.0
73,ILDERLANDIO SAMPAIO TRINDADE,ILDERLANDIO,MUNDO NOVO,PSB,ELEITO POR QP,588,0.0,500.0
74,LEANDRO REBOUÇAS DO ROSARIO,LEO DE QUARENTINHA,MARAGOGIPE,PSC,ELEITO POR MÉDIA,579,0.0,0.0
75,JOSE ROBERTO JESUS VIEIRA,ZÉ ROBERTO,SÃO SEBASTIÃO DO PASSÉ,PL,ELEITO POR QP,571,0.0,1400.0
76,RENATO MEIDIAN BERNARDO VIEIRA,MEIDIAN DA CHAPADA,RIACHÃO DO JACUÍPE,PTB,ELEITO POR QP,570,0.0,325.0
77,JOSE BOAVENTURA DOS SANTOS,KAIÁ DA SAÚDE,ITABUNA,AVANTE,ELEITO POR MÉDIA,569,0.0,90.9
78,JOSE TAVARES DA SILVA,TAVARES DE BETOCA,IBOTIRAMA,PP,ELEITO POR MÉDIA,566,0.0,2868.31
79,JONATHAS GOMES AZEVEDO,DHOW DA DIVISA,MUCURI,PROS,ELEITO POR QP,564,0.0,750.0
80,MARCELO NUNES DE OLIVEIRA,MARCELO NUNES,TREMEDAL,PROS,ELEITO POR QP,563,0.0,1000.0
81,ERNANDI RAMOS DE MAGALHÃES,NANDO,MUQUÉM DO SÃO FRANCISCO,PSB,ELEITO POR QP,559,0.0,5315.0
82,UELINGTON DA SILVA,KEKO DO BENONE,PAULO AFONSO,AVANTE,ELEITO POR QP,558,0.0,956.36
83,ROBSON LUIZ LEMOS DOS SANTOS,ROBSON LUIZ ,ENTRE RIOS,PP,ELEITO POR MÉDIA,557,0.0,500.0
84,AGNALDO CARNEIRO DE FREITAS,AGNALDO FREITAS,SÃO DOMINGOS,PSD,ELEITO POR QP,556,0.0,6600.0
85,JUDSON ALMEIDA DE SOUZA,LIRA DA FARMÁCIA,BOQUIRA,PSD,ELEITO POR QP,553,0.0,1304.0
86,EVERTON MATHEUS SILVA OLIVEIRA,EVERTON OLIVEIRA,CALDEIRÃO GRANDE,DEM,ELEITO POR QP,551,0.0,1900.0
87,LUCIANA PIRES DE OLIVEIRA,LUCIANA DA LOOK GÁS,PRADO,PSD,ELEITO POR MÉDIA,551,0.0,0.0
88,ROBSON RODRIGUES DE VASCONCELOS,ROBSON DE CÉU,MUQUÉM DO SÃO FRANCISCO,PSB,ELEITO POR QP,548,0.0,5090.02
89,JOAO BATISTA PEREIRA,BATISTA,FILADÉLFIA,PSC,ELEITO POR QP,539,0.0,1800.0
90,WARLLES SENA DOS SANTOS,WARLLES DE RUTA,MALHADA,PT,ELEITO POR QP,531,0.0,28.0
91,JOAO LUIZ RAMOS DE OLIVEIRA,JOTA DE TERMICIO,BURITIRAMA,PP,ELEITO POR QP,530,0.0,250.0
92,ROBERTO CARLOS CASAES RAMOS,CARRINHO DE ALTINO,ANTÔNIO CARDOSO,PODE,ELEITO POR QP,525,0.0,800.0
93,TEONIS LINS FREITAS,THÉO,AMÉLIA RODRIGUES,PSD,ELEITO POR MÉDIA,522,0.0,300.0
94,EDSON BATISTA BARBOSA,PROFESSOR EDSON,FORMOSA DO RIO PRETO,PSD,ELEITO POR QP,522,0.0,400.13000000000005
95,IOLVAN DA SILVA BISPO,PROFESSOR VOCA,OLIVEIRA DOS BREJINHOS,PSD,ELEITO POR MÉDIA,522,0.0,2010.0
96,JORGE ROCHA DA CRUZ,JUCO DO POVO,ITAPARICA,PSB,ELEITO POR QP,521,0.0,0.0
97,ALBERICO SANTOS CERQUEIRA,ALBERICO,RIBEIRA DO AMPARO,PDT,ELEITO POR QP,518,0.0,8216.310000000001
98,MYLTON PEREIRA DE CARVALHO,NITIN DO JAVI,MUQUÉM DO SÃO FRANCISCO,PSB,ELEITO POR MÉDIA,511,0.0,6721.07
99,GIDELSON FERREIRA DE SANTANA,GIDELSON,OLINDINA,PSD,ELEITO POR QP,507,0.0,1380.0
100,JUCILANDE DE JESUS ROCHA,JUCILANDE DE ITABAÍ,MACARANI,PL,ELEITO POR QP,504,0.0,205.72
101,DEOLISANO JOSE DE SOUSA,DEÓ,ITANHÉM,PSD,ELEITO POR QP,503,0.0,1858.0
102,RENATA DE ARAÚJO SOUSA,RENATA DE LEU,ENCRUZILHADA,PDT,ELEITO POR MÉDIA,500,0.0,1680.0
103,SAMUEL OLIVEIRA SATELIS ALVES,SAMUEL DE FAROFA,IRAQUARA,PC do B,ELEITO POR QP,500,0.0,200.0
104,JOELSON DE OLIVEIRA SILVA DANTAS,JOELSON DANTAS,IRARÁ,PSB,ELEITO POR MÉDIA,499,0.0,500.0
105,MANOEL PRATES DA SILVA,MANOEL DE NOCA,GUAJERU,PSD,ELEITO POR QP,499,0.0,1775.0
106,ROBSON RAMOS DE JESUS,ROBSON RAMOS,RODELAS,PP,ELEITO POR QP,497,0.0,3035.0
107,CLEITON OLIVEIRA PIRES SILVA,CLEITON PIRES,MUNDO NOVO,PSB,ELEITO POR QP,497,0.0,500.0
108,OSCARINO DA SILVA VIEIRA,OSCARINO VIEIRA,CRISTÓPOLIS,PSD,ELEITO POR QP,495,0.0,2200.5
109,LENOILDO RIBEIRO DOS SANTOS,CANELINHA,ITACARÉ,PL,ELEITO POR QP,495,0.0,75.95
110,DIOCLESIANO BRITO COSTA,DIO DE TONHO DE BINA,NOVA SOURE,PSD,ELEITO POR MÉDIA,494,0.0,1912.54
111,ANTONIO LISBOA CARNEIRO OLIVEIRA,ANTONIO DE ALEXANDRE,PÉ DE SERRA,DEM,ELEITO POR QP,493,0.0,0.0
112,JOSE ROBERTO DOS SANTOS,BETO DA ILHA,GLÓRIA,PP,ELEITO POR QP,490,0.0,6350.0
113,GILMAR COSTA DE FIGUEIREDO,GILMAR DO BURACO DAGUA,SERRA PRETA,PP,ELEITO POR QP,490,0.0,0.0
114,RONALDO GOMES LACERDA,RONALDO LACERDA,NOVA VIÇOSA,DEM,ELEITO POR QP,490,0.0,1840.0
115,JOSÉLIA ROSA RIBEIRO,CÉLIA DE VAN BASTER,ITAJUÍPE,PC do B,ELEITO POR QP,489,0.0,863.0
116,ADRIANA DOS SANTOS SILVA,ADRIANA SILVA,CACHOEIRA,PODE,ELEITO POR QP,489,0.0,100.0
117,DENISIO GOMES NOLASCO PEREIRA,TITAN DA ESCOLINHA,MACARANI,PL,ELEITO POR QP,488,0.0,205.72
118,ANAELSON PINHEIRO DE SANTANA,ANAELSON,OLINDINA,PSD,ELEITO POR QP,488,0.0,1760.0
119,JICLEDIO DA SILVA OLIVEIRA,JICLEDIO,SÃO DOMINGOS,PSD,ELEITO POR QP,487,0.0,4598.8
120,MARUSAN FERREIRA DOS ANJOS,MARUSAN DO BETIM,SÃO DESIDÉRIO,PSD,ELEITO POR MÉDIA,487,0.0,666.5
121,JOSE ARIVALDO FONSECA DA ROCHA,ZÉ ARIVALDO,OLINDINA,PSD,ELEITO POR MÉDIA,485,0.0,1760.0
122,CRISTIANO ALVES DOS SANTOS,CRISTIANO DE LOURO PAI VEI,CACHOEIRA,PSDB,ELEITO POR QP,484,0.0,0.0
123,SANDRO BARRETO DE SOUZA,SANDRO DA LAVRA VELHA,GENTIO DO OURO,PSD,ELEITO POR QP,484,0.0,1000.0
124,FRANCISCO BARBOZA DO NASCIMENTO,NASCIMENTO BARBOZA,RIACHÃO DAS NEVES,MDB,ELEITO POR QP,480,0.0,94.85
125,PAULO DA COSTA,PAULO RADIOLA,GUARATINGA,PT,ELEITO POR QP,480,0.0,1278.0
126,ABEL GLORIA MOREIRA,ABEL MOREIRA,MASCOTE,REPUBLICANOS,ELEITO POR QP,478,0.0,769.22
127,ANGELICA SAPUCAIA DA SILVA,ANGELICA SAPUCAIA,CACHOEIRA,PL,ELEITO POR QP,477,0.0,0.0
128,ADRIANO ALVES DOS SANTOS,DADÁ DE SEU GERSON,BURITIRAMA,PP,ELEITO POR QP,476,0.0,1150.0
129,JANILTON ALVES DE SOUZA,NILTON ALVES,MACARANI,PL,ELEITO POR QP,475,0.0,205.72
130,ANDRÉ SENA DE ALMEIDA,ANDRÉ DE AMANDA,GOVERNADOR MANGABEIRA,PT,ELEITO POR QP,474,0.0,0.0
131,GILMAR NASCIMENTO DA PAIXÃO,GILMAZÃO,ANGICAL,PP,ELEITO POR QP,474,0.0,2260.8999999999996
132,EPIFANIO SOUZA SANTOS,EPIFANIO,SERRA PRETA,PP,ELEITO POR MÉDIA,472,0.0,0.0
133,CELSO RIBEIRO DOS SANTOS,CELSINHO,BURITIRAMA,DEM,ELEITO POR QP,471,0.0,200.0
134,UILSON DE ANDRADE BASTOS,LICIO MECÂNICO,ANGUERA,PODE,ELEITO POR QP,470,0.0,0.0
135,ADENOR BRANDAO DE SAO LEAO,TOI,MACAJUBA,MDB,ELEITO POR QP,469,0.0,1045.0
136,CLAUDIO DOS ANJOS ALMEIDA,CLAUDIO DO BANCO,SANTA LUZIA,REPUBLICANOS,ELEITO POR QP,466,0.0,236.5
137,MARIA ALICE DE OLIVEIRA CARVALHO,ALICE DA PIMENTA,MASCOTE,PSD,ELEITO POR QP,465,0.0,969.22
138,ROMILDA DE OLIVEIRA SANTOS CARMO,ROMILDA,BOM JESUS DA SERRA,PC do B,ELEITO POR QP,463,0.0,200.0
139,FABIO JOSE ALMEIDA SANTOS,FÁBIO ALMEIDA,ITAJUÍPE,PP,ELEITO POR MÉDIA,463,0.0,755.0
140,JOSE ROBERTO MACHADO SOARES,ZE DA PRAIA,ESPLANADA,PSDB,ELEITO POR MÉDIA,462,0.0,115.91
141,ANTONIO CARLOS DOS SANTOS GOMES,TOIN DE BERENGA,IBIRATAIA,DEM,ELEITO POR MÉDIA,461,0.0,0.0
142,JOÃO SILVA SOUZA,JOÃO DO ROLO,BOQUIRA,PSB,ELEITO POR QP,459,0.0,1304.0
143,LAZARO PALMA DOS SANTOS,IRMÃO LÁZARO,SÃO SEBASTIÃO DO PASSÉ,PL,ELEITO POR MÉDIA,458,0.0,0.0
144,ELIENE ALVES DOS REIS SANTOS,ELIENE,BARRA DO MENDES,PL,ELEITO POR MÉDIA,454,0.0,2110.0
145,IVONE BATISTA DE SOUZA,IVONE,MUNDO NOVO,PSB,ELEITO POR QP,452,0.0,500.0
146,EDMILSON BORGES DO NASCIMENTO,EDMILSON BORGES,ITAJUÍPE,PODE,ELEITO POR MÉDIA,452,0.0,0.0
147,ELISA PAIXÃO DO NASCIMENTO,ELISA  DE DOMINGAS,GOVERNADOR MANGABEIRA,PSD,ELEITO POR QP,451,0.0,0.0
148,LEANDRO JOSÉ BASTOS SILVA,LEO PACAPIM,SALINAS DA MARGARIDA,PSD,ELEITO POR QP,450,0.0,200.0
149,ZEZITO FRANCISCO PEREIRA,ZEZITO PEREIRA,OLIVEIRA DOS BREJINHOS,PP,ELEITO POR MÉDIA,450,0.0,6408.0
150,RUMÃO GALDINO SOBRINHO,RUMÃO,CAFARNAUM,PSB,ELEITO POR QP,450,0.0,0.0
151,WANDERSON DA ROCHA LEITE,DR WANDERSON ADVOGADO,PRADO,PROS,ELEITO POR MÉDIA,448,0.0,128.0
152,ANTONIO CARLOS PEREIRA DOS SANTOS,TOINHO DE JULIÃO,ARAMARI,PP,ELEITO POR QP,447,0.0,161.01
153,JOSE VANDERLON DA SILVA TEIXEIRA,ROCHA,SÃO DOMINGOS,PSD,ELEITO POR QP,446,0.0,4200.0
154,MANUEL JOSE DA SILVA,ZEZITINHO,APORÁ,DEM,ELEITO POR QP,444,0.0,200.0
155,ADALIRIO SANTOS DE SOUZA,ADALÍRIO RANCHO ALEGRE,CARAVELAS,DC,ELEITO POR QP,443,0.0,561.5
156,MOURIVAL SANTIAGO DA SILVA,MOURIVAL SANTIAGO,ITAETÉ,PC do B,ELEITO POR QP,442,0.0,860.0
157,MANOEL CARLOS ALMEIDA SANTOS,CARLOS DE SANTA RITA,BOQUIRA,PSB,ELEITO POR MÉDIA,442,0.0,1304.0
158,ADEMILTON DE JESUS,HÉLIO DO CAJÁ,IBIRAPITANGA,PP,ELEITO POR QP,441,0.0,1337.0
159,ISRAEL JOSE DA SILVA,ISRAEL SILVA,BURITIRAMA,PP,ELEITO POR MÉDIA,438,0.0,1250.0
160,MARLENE GOMES MARTINS,MARLENE,IPUPIARA,PP,ELEITO POR QP,438,0.0,1000.0
161,CLADSON JOSE ALVES DURÃES,KAKA,GENTIO DO OURO,PSD,ELEITO POR MÉDIA,432,0.0,1000.0
162,MARCOS FLAVIO FRANÇA BATISTA,FLAVINHO CORRERIA,AMÉLIA RODRIGUES,PP,ELEITO POR QP,431,0.0,0.0
163,MARINALVA  PALMEIRA DA  SILVA,MARINALVA MÃE DE GUEGUEL,CONCEIÇÃO DA FEIRA,PP,ELEITO POR MÉDIA,424,0.0,9180.0
164,MARCICLEI DO CARMO ALMEIDA,MARCICLEI,PRADO,PP,ELEITO POR QP,424,0.0,128.0
165,JOSÉ RAMOS FERREIRA,ZEZINHO DE CLEÓ,SANTA LUZIA,PP,ELEITO POR QP,423,0.0,543.4200000000001
166,ANTONIO ALVES GUIMARAES NETO,NETO DE ADELMÁRIO,TEOLÂNDIA,PP,ELEITO POR QP,423,0.0,0.0
167,ERNANDES DE SOUZA SILVA,CAPOEIRA,ARAÇÁS,DEM,ELEITO POR QP,423,0.0,2473.58
168,ANDRE CARLOS CONCEIÇÃO DOS SANTOS,DÉO DA AMBULÂNCIA,ITUBERÁ,PSDB,ELEITO POR QP,423,0.0,160.0
169,LUCAS PIRES DOS SANTOS,LUCAS PIRES,AMÉLIA RODRIGUES,PC do B,ELEITO POR QP,422,0.0,0.0
170,DJONE BATISTA DOS SANTOS,DJONE SANTOS,ITACARÉ,PSB,ELEITO POR MÉDIA,421,0.0,700.0
171,ADERLANDO DE JESUS FREITAS,POPO DO OVO,SANTA CRUZ CABRÁLIA,PP,ELEITO POR QP,420,0.0,950.0
172,IVANILDO SOUZA SILVA,VAN DE CHICO,RODELAS,PP,ELEITO POR QP,418,0.0,3135.0
173,BARTOLOMEU GUIMARÃES COSTA,BETO,MURITIBA,PSB,ELEITO POR QP,417,0.0,0.0
174,ANDRE VINICIUS SOUZA COSTA,VINICIUS DE BARAU,CAMAMU,REPUBLICANOS,ELEITO POR QP,417,0.0,2779.0
175,JOSÉ AUDEMÁRIO OLIVEIRA HAYNE,MALINHO,ITABERABA,PL,ELEITO POR MÉDIA,412,0.0,560.0
176,ISRAEL JESUS DA SILVA,ISRAEL,CABACEIRAS DO PARAGUAÇU,PSD,ELEITO POR MÉDIA,412,0.0,0.0
177,HETIANE ALVES DO NASCIMENTO,HETIENE DO ENTRONCAMENTO DE CR,OLINDINA,PSB,ELEITO POR QP,412,0.0,2941.35
178,GERSON MARQUES GUIMARÃES,GERSON ,SÃO JOSÉ DO JACUÍPE,PROS,ELEITO POR QP,412,0.0,0.0
179,JAILTON EVANGELISTA DOS SANTOS,JAILTON,MANSIDÃO,PSB,ELEITO POR QP,410,0.0,0.0
180,VALDIR SANTOS DE JESUS,VALDIR,NILO PEÇANHA,DEM,ELEITO POR QP,409,0.0,1200.0
181,CLAUDIA RIBEIRO DE ALMEIDA VITAL,CLAUDIA DA SAÚDE,RIACHÃO DAS NEVES,PSD,ELEITO POR QP,408,0.0,91.85
182,ROQUELINA RODRIGUES DE SOUZA,ROQUINHA,SÃO FÉLIX,DEM,ELEITO POR QP,408,0.0,203.0
183,IVANY MARIA DA SILVA,IVANY DE NIAKA,RODELAS,PP,ELEITO POR QP,407,0.0,3135.0
184,GIRLEI LIMA NAZARETH,GIRLEI LAGE,SANTA CRUZ CABRÁLIA,PV,ELEITO POR MÉDIA,407,0.0,0.0
185,MOISES REIS DO LAGO,MOISES LAGO,CACHOEIRA,PODE,ELEITO POR MÉDIA,407,0.0,0.0
186,ADAILTON SOUZA RIBEIRO,DADAI DE VITA,MILAGRES,DEM,ELEITO POR QP,406,0.0,1650.0
187,JOÃO BATISTA RIBEIRO CERQUEIRA,BATISTA,BARRA DO CHOÇA,PSD,ELEITO POR QP,403,0.0,0.0
188,JOTAMAR FERREIRA SANTOS,JOTAMAR,SANTANÓPOLIS,PP,ELEITO POR QP,402,0.0,563.0
189,CARLOS ANDRE SOUZA DA MATA,ANDRE,SÃO FÉLIX,DEM,ELEITO POR QP,401,0.0,203.0
190,POLISVAN DA SILVA SANTOS,POLISVAN PRODUÇÕES,SANTA BRÍGIDA,PP,ELEITO POR QP,401,0.0,1280.0
191,MARLON FERREIRA CERQUEIRA SANTOS,MARLON FERREIRA,ÁGUA FRIA,PL,ELEITO POR QP,401,0.0,0.0
192,MAURIVAN JOAQUIM DO RÊGO,MAURIVAN,BAIANÓPOLIS,PL,ELEITO POR QP,400,0.0,0.0
193,NILSON RODRIGUES DOS SANTOS,NILSON DO CARDOSO,BIRITINGA,PC do B,ELEITO POR QP,399,0.0,512.0
194,FABIO DIAS DOS SANTOS SANTANA,FABIO DIAS,RIACHÃO DAS NEVES,PTB,ELEITO POR MÉDIA,398,0.0,94.85
195,COSME GOMES DE CARVALHO,IRMÃO CONGUINHA,SANTA LUZIA,PP,ELEITO POR MÉDIA,398,0.0,543.4200000000001
196,ANTONIO EDUARDO SANTANA DA RESSURREIÇÃO,PROFESSOR BOLOCA,PRADO,REPUBLICANOS,ELEITO POR QP,396,0.0,0.0
197,AMADEU DE JESUS OLIVEIRA,AMADEU,ITAETÉ,SOLIDARIEDADE,ELEITO POR MÉDIA,396,0.0,860.0
198,JOSÉ BORGES DOS SANTOS,ZÉ BORGES,TEOLÂNDIA,PT,ELEITO POR QP,396,0.0,227.25
199,PEDRO D ANGELO DE SOUZA,PEDRÃO,LAJEDO DO TABOCAL,PP,ELEITO POR QP,396,0.0,300.0
200,GRACIANO DOURADO DE SOUZA,GRACIANO DE ZELENO,SANTA BRÍGIDA,PP,ELEITO POR QP,395,0.0,1280.0
201,GENILSON SEVERO DE SOUZA,GENILSON DA LAGOA,CAFARNAUM,PSB,ELEITO POR MÉDIA,393,0.0,0.0
202,PERGENTINO MAIA FILHO,PREJINHO,FILADÉLFIA,DEM,ELEITO POR MÉDIA,391,0.0,800.0
203,JOSELICE BISPO SACRAMENTO,LICE DE ABEL,CABACEIRAS DO PARAGUAÇU,PP,ELEITO POR QP,390,0.0,0.0
204,ADANITO JOSÉ DE SOUZA,BIO DE GUILHERMINO,MULUNGU DO MORRO,PSD,ELEITO POR QP,390,0.0,100.0
205,WASHINGTON LUIZ CARDOSO DANTAS,RONE CARDOSO,ARAMARI,PP,ELEITO POR QP,390,0.0,161.01
206,CARLOS ALBERTO RODRIGUES DA FONSECA,FONSECA,ARAMARI,PC do B,ELEITO POR QP,389,0.0,161.01
207,AVELINO FRANCISCO DE JESUS,AVELINO FRANCISCO,TEOLÂNDIA,PP,ELEITO POR QP,387,0.0,0.0
208,KYMURA DOURADO YOSHIDA,KYMURA   DOURADO,AMÉRICA DOURADA,PSDB,ELEITO POR QP,385,0.0,0.0
209,JAIRO DOS SANTOS,JAIRO DA SODOMA,MUNIZ FERREIRA,PSC,ELEITO POR QP,382,0.0,900.0
210,ROBERTO SANTOS DE ARAUJO,ROBERTO DE SANTANA,CONCEIÇÃO DO ALMEIDA,PL,ELEITO POR QP,382,0.0,0.0
211,JULIANA FRAGA E CHAGAS,JULIANA CHAGAS,ARATACA,PP,ELEITO POR QP,381,0.0,0.0
212,NIZILDA NASCIMENTO CORREIA DOS SANTOS,NIZILDA DE ERASMO,MILAGRES,DEM,ELEITO POR MÉDIA,379,0.0,700.0
213,DELCIK DE SOUZA OLIVEIRA,DEL DE TOCOS,ANTÔNIO CARDOSO,PT,ELEITO POR QP,378,0.0,200.0
214,LARYSSA SALLES SOUZA,LARYSSA DE MAURÍCIO,ARATACA,PP,ELEITO POR QP,378,0.0,0.0
215,UBIRATAM DOS SANTOS,UBIRATAM DA SAÚDE,MALHADA,AVANTE,ELEITO POR QP,377,0.0,28.0
216,EVERALDO ALVES DE OLIVEIRA,EVERALDO DE JACARECI,CAMACÃ,PP,ELEITO POR QP,377,0.0,0.0
217,GERALDO DOS SANTOS GONCALVES,GERALDO,SÃO FÉLIX,DEM,ELEITO POR QP,376,0.0,203.0
218,CARLOS NASCIMENTO MELO,KOKA DE ZÉ DE HENRIQUE,GLÓRIA,PP,ELEITO POR QP,375,0.0,6250.0
219,CLOVES ROCHA OLIVEIRA,CLOVES DE OTACINA,MANSIDÃO,PP,ELEITO POR QP,373,0.0,0.0
220,SALVADOR DE JESUS PEREIRA,SALVADOR,BOA NOVA,PP,ELEITO POR QP,372,0.0,500.0
221,DOUGLAS CERQUEIRA DA CONCEIÇÃO,DOUGLINHAS,ITAPARICA,PT,ELEITO POR MÉDIA,372,0.0,200.0
222,WILLIANS SOUZA DA FONSECA,PROFESSOR WILLIANS,JANDAÍRA,PV,ELEITO POR QP,371,0.0,0.0
223,SILVIO ROMERO ALMEIDA DE CARVALHO,ROMERO,RODELAS,PP,ELEITO POR QP,370,0.0,3135.0
224,JARCIONILDO JOSÉ DE SOUZA,JARÇO DO RAULINO,BAIANÓPOLIS,PL,ELEITO POR QP,367,0.0,0.0
225,ALESSANDRO PASSOS DA SILVA,SANDRO,NILO PEÇANHA,PT,ELEITO POR QP,367,0.0,0.0
226,JENIVALDO ALVES DOS SANTOS,JENE DO POVO,ARATUÍPE,PT,ELEITO POR QP,367,0.0,740.0
227,LEANDRO SANTOS DE SOUZA,LEANDRO,CARAVELAS,DC,ELEITO POR MÉDIA,367,0.0,261.5
228,OCLECIO BATISTA DE ALMEIDA,CLECINHO DO TÓ,FILADÉLFIA,PL,ELEITO POR QP,366,0.0,800.0
229,JANETE SILVA DOS SANTOS ARGOLO,NETE ARGOLO,LAJE,PL,ELEITO POR QP,365,0.0,0.0
230,GIVALDO JOSE ANES MACHADO,GIVALDO DA AMBULANCIA,ITACARÉ,REPUBLICANOS,ELEITO POR QP,364,0.0,175.95
231,JOEL DO BOMFIM ALVES,JOEL BOMFIM,COTEGIPE,PSD,ELEITO POR MÉDIA,364,0.0,240.0
232,ANTONIO BARROS DA CAPELA FILHO,CAPELA,ITAJU DO COLÔNIA,PSD,ELEITO POR QP,364,0.0,917.6
233,DIEGO GARCIA TEIXEIRA,DIEGO DA SAUDE,ALCOBAÇA,PSB,ELEITO POR MÉDIA,364,0.0,200.0
234,EDSON DA SILVA PEREIRA,EL DE CELÉ,ANGUERA,PODE,ELEITO POR QP,361,0.0,0.0
235,MARCOS JOSE RIOS FIGUEIREDO,MARCOS RIOS,TERRA NOVA,REPUBLICANOS,ELEITO POR QP,360,0.0,0.0
236,ANTÔNIO BENIGNO TELES,TOINHO DE TOTONHO,PEDRO ALEXANDRE,PSD,ELEITO POR QP,360,0.0,1000.0
237,MIGUEL CAMPOS JUNIOR,MIGUEL CAMPOS,GLÓRIA,PP,ELEITO POR MÉDIA,360,0.0,5950.0
238,WILLIAN CARNEIRO SILVA,WILLIAN DA AREIA,ANGUERA,PODE,ELEITO POR MÉDIA,359,0.0,0.0
239,JOSÉ ANTONIO SANTOS BOMFIM,ÍNDIO EVENTOS,CAMACÃ,PSD,ELEITO POR QP,358,0.0,133.32999999999998
240,ELIANE PEREIRA NASCIMENTO,ANE A GALEGA,NILO PEÇANHA,DEM,ELEITO POR MÉDIA,357,0.0,2700.0
241,SILVINO CONCEIÇÃO DOS SANTOS,DIDO,SÃO FÉLIX,DEM,ELEITO POR MÉDIA,352,0.0,203.0
242,LADSON ROCHA DA SILVA,LADSON DE LUIZ DE ZUQUINHA,GOVERNADOR MANGABEIRA,PSD,ELEITO POR MÉDIA,352,0.0,0.0
243,DOMINGO PEREIRA ALVES,AILTON DO MERCADO,PRADO,PP,ELEITO POR MÉDIA,351,0.0,128.0
244,CLAUDIONOR MENEZES DA SILVA,CLAÚDIO CABELEIREIRO,BOA NOVA,PP,ELEITO POR QP,350,0.0,500.0
245,VALDEMIRE SIMOES DE ARAUJO,MIRE,LAMARÃO,PSD,ELEITO POR QP,349,0.0,500.0
246,JOÃO DE SOUZA ALVES,JOÃO MORÃO,CONCEIÇÃO DA FEIRA,PT,ELEITO POR MÉDIA,349,0.0,610.99
247,DOMINGOS DOS SANTOS SANTANA,DOMINGUINHOS,RAFAEL JAMBEIRO,DEM,ELEITO POR MÉDIA,349,0.0,475.0
248,JOSE MARCOS DA SILVA BITTENCOURT,BATATA DO ESPORTE,TERRA NOVA,CIDADANIA,ELEITO POR QP,349,0.0,0.0
249,LUIS FERNANDO DOS SANTOS PEREIRA,FERNANDO,MEDEIROS NETO,PT,ELEITO POR MÉDIA,348,0.0,4585.4
250,MARIA DA CONCEIÇÃO SILVA GONÇALVES,CONCEIÇÃO GONÇALVES,SÃO SEBASTIÃO DO PASSÉ,PTB,ELEITO POR MÉDIA,347,0.0,0.0
251,DELSON BISPO DE SOUZA,DELSON DA CONQUISTA,CAFARNAUM,PT,ELEITO POR QP,346,0.0,0.0
252,FLORISVALDO MORAIS DOS SANTOS,FLORISVALDO LÔ,ANAGÉ,PSB,ELEITO POR MÉDIA,343,0.0,0.0
253,TEREZINHA CONCEIÇÃO DO AMOR DIVINO,ANE DO SINDICATO,GOVERNADOR MANGABEIRA,PT,ELEITO POR MÉDIA,343,0.0,250.0
254,JUCELINO CERQUEIRA GAMA,JUTE GAMA,SANTA TEREZINHA,PP,ELEITO POR MÉDIA,342,0.0,400.0
255,LUCIANO BARROS NASCIMENTO DE OLIVEIRA,LUCIANO OLIVEIRA,BELMONTE,PC do B,ELEITO POR QP,341,0.0,0.0
256,JOSE CARLOS MOREIRA,CARLINHOS DO BREJO,GLÓRIA,PSD,ELEITO POR QP,340,0.0,2850.0
257,ALLISON SANTANA ALMEIDA,ALLISON SANTANA,MACAJUBA,MDB,ELEITO POR QP,339,0.0,1045.0
258,ADILTON GOMES DA CRUZ,BIRO DO FOJO,ITACARÉ,PT,ELEITO POR QP,339,0.0,75.95
259,JOSE CONCEIÇÃO DE JESUS,ZECA CACIQUE,PRADO,PC do B,ELEITO POR MÉDIA,338,0.0,0.0
260,JOSE ANDRADE DOS SANTOS JUNIOR,JUNIOR DO BOM JESUS,ITAJU DO COLÔNIA,PSD,ELEITO POR QP,335,0.0,67.6
261,WILSON BISPO DE JESUS,WILSON DO MICRO ÔNIBUS,TERRA NOVA,PTC,ELEITO POR QP,335,0.0,0.0
262,ADOALDO MESQUITA PINHEIRO,IRMÃO ALDO,NOVA REDENÇÃO,PT,ELEITO POR QP,334,0.0,1397.5
263,JANIO DE OLIVEIRA ALMEIDA,JANIO,CONDE,PSD,ELEITO POR MÉDIA,332,0.0,0.0
264,NILDA DOS REIS JURITI DA SILVA,NILDA MOURA,LAMARÃO,PT,ELEITO POR QP,332,0.0,500.0
265,EDIVALDO ALVES DOS SANTOS JUNIOR,ABIL PAREDÃO,ARAÇÁS,DEM,ELEITO POR QP,331,0.0,2457.58
266,PAULO SANTOS BOTELHO,PAULO DO PENACHINHO,BOA NOVA,PSD,ELEITO POR MÉDIA,331,0.0,544.0
267,JAILSON DE OLIVEIRA DAMASCENO,JAI DE ZÉ VERMELHO,LAMARÃO,PSD,ELEITO POR QP,330,0.0,500.0
268,JOSÉ SILVEIRA LINO FILHO,ZÉ SILVEIRA,AMÉLIA RODRIGUES,PC do B,ELEITO POR MÉDIA,330,0.0,0.0
269,DENIS MESSIAS SENE OLIVEIRA,DENIS MESSIAS,MANSIDÃO,PP,ELEITO POR MÉDIA,329,0.0,0.0
270,ANILSON SOUZA DA HORA,ANILSON DO GELO,CAMAMU,REDE,ELEITO POR MÉDIA,328,0.0,129.0
271,ROSINEIDE ALVES DE AMORIM,ROSA DE JORGE,RODELAS,PP,ELEITO POR MÉDIA,325,0.0,3135.0
272,ADAO MILTON BATISTA PIRES,DÃO DO GALDINO,CRISTÓPOLIS,PSB,ELEITO POR QP,323,0.0,1880.4
273,REGINALDO VITORIO SOUSA,REGE PRETO,SANTANÓPOLIS,PP,ELEITO POR QP,323,0.0,563.0
274,HUMBERTO DE ALENCAR CAMPOS,BETO CABEÇÃO,SANTA BÁRBARA,PTB,ELEITO POR QP,323,0.0,325.0
275,VALDEMAR RIBEIRO DE OLIVEIRA,VAVÁ DE BECA,CABACEIRAS DO PARAGUAÇU,MDB,ELEITO POR QP,322,0.0,0.0
276,IVAN FERNANDES DOS SANTOS,BUBU DE CARLINHOS,OURIÇANGAS,PSB,ELEITO POR QP,319,0.0,250.0
277,EDMILSON SILVA AMORIM,EDMILSON DA CABECEIRA,GUARATINGA,DEM,ELEITO POR QP,318,0.0,0.0
278,GERSER OLIVEIRA SOUSA,GERSER,ITAJU DO COLÔNIA,PT,ELEITO POR QP,317,0.0,417.6
279,VALDIR SOUZA CARVALHO,VALDIR CARVALHO,NOVA VIÇOSA,PSD,ELEITO POR MÉDIA,317,0.0,1500.0
280,EDSON PAULINO DA SILVA,GUEM DE BIÉ,SANTA TEREZINHA,PSB,ELEITO POR QP,316,0.0,0.0
281,JOELCIO SANTOS BISPO,JOELCIO,MACAJUBA,MDB,ELEITO POR MÉDIA,315,0.0,1245.0
282,DIONISIO DOS SANTOS SILVA FILHO,KÉU SANTOS,MORPARÁ,PSB,ELEITO POR QP,314,0.0,372.0
283,VALMIR DE JESUS SANTOS,VALMIR SEMPRE PRESENTE,MUNIZ FERREIRA,PC do B,ELEITO POR QP,313,0.0,120.0
284,MIGUEL PEREIRA SANTOS,MIGUEL DA MATINHA,ITACARÉ,PL,ELEITO POR MÉDIA,313,0.0,75.95
285,ALAN MENEZES LIRIO,ALAN DE MINDE,MUNIZ FERREIRA,PSC,ELEITO POR QP,312,0.0,1020.0
286,TATIANE DA SILVA ANDRADE,TATY DA SAÚDE,BOA NOVA,PP,ELEITO POR MÉDIA,312,0.0,500.0
287,EDGAR CARLOS ALVES SILVA,EDGAR,MUNIZ FERREIRA,PP,ELEITO POR MÉDIA,311,0.0,150.0
